{
  "$schema": "https://NePA.local/schemas/wire-format.schema.json",
  "wire_format_id": "mqtt-311-wire-format-v2",
  "protocol": "MQTT",
  "protocol_version": "3.1.1",
  "source_sha256": "c45a1f4f3d0d9a66b3f890dce49a1e2ddeae69cfd67f907a5b6e97a6d64a0b54",
  "model_version": "1.1",
  "description": "Protocol-independent wire-format model instantiated for MQTT 3.1.1. The model supports reusable wire data types, multiple protocol data units, binary/text/mixed encodings, alternative framing rules, ordered layouts, and message types selected by field value, syntax, context, or transport.",
  "data_types": [
    {
      "id": "mqtt-two-byte-integer",
      "name": "Two Byte Integer",
      "kind": "unsigned integer",
      "representation": "16 bits in big-endian byte order",
      "definition": "The most significant byte precedes the least significant byte on the network.",
      "constraints": [
        "The encoded value occupies exactly two bytes."
      ],
      "source": {
        "section": "1.5.2 Integer data values",
        "page": 13,
        "locator": "lines 173-176",
        "excerpt": "Integer data values are 16 bits in big-endian order: the high order byte precedes the lower order byte. This means that a 16-bit word is presented on the network as Most Significant Byte (MSB), followed by Least Significant Byte (LSB)."
      }
    },
    {
      "id": "mqtt-utf8-encoded-string",
      "name": "UTF-8 Encoded String",
      "kind": "length-prefixed string",
      "representation": "two-byte big-endian byte length followed by UTF-8 encoded character data",
      "definition": "The two-byte prefix gives the number of bytes in the UTF-8 encoded character data that follows.",
      "constraints": [
        "The encoded character data length is between 0 and 65535 bytes unless a field-specific rule states otherwise.",
        "Character data MUST be well-formed UTF-8.",
        "Character data MUST NOT contain U+0000."
      ],
      "source": {
        "section": "1.5.3 UTF-8 encoded strings",
        "page": 13,
        "locator": "page 13 lines 177-188; page 14 lines 190-197",
        "excerpt": "Each of these strings is prefixed with a two byte length field that gives the number of bytes in a UTF-8 encoded string itself, as illustrated in Figure 1.1 Structure of UTF-8 encoded strings below. Consequently there is a limit on the size of a string that can be passed in one of these UTF-8 encoded string components; you cannot use a string that would encode to more than 65535 bytes. Unless stated otherwise all UTF-8 encoded strings can have any length in the range 0 to 65535 bytes.\n\nThe character data in a UTF-8 encoded string MUST be well-formed UTF-8 as defined by the Unicode specification [Unicode] and restated in RFC 3629 [RFC3629]. In particular this data MUST NOT include encodings of code points between U+D800 and U+DFFF. If a Server or Client receives a Control Packet containing ill-formed UTF-8 it MUST close the Network Connection [MQTT-1.5.3-1].\n\nA UTF-8 encoded string MUST NOT include an encoding of the null character U+0000. If a receiver (Server or Client) receives a Control Packet containing U+0000 it MUST close the Network Connection [MQTT-1.5.3-2]."
      }
    },
    {
      "id": "mqtt-binary-data",
      "name": "Binary Data",
      "kind": "length-prefixed byte sequence",
      "representation": "two-byte big-endian byte length followed by that many data bytes",
      "definition": "The two-byte prefix gives the number of binary data bytes that follow and is not included in the length.",
      "constraints": [
        "The binary data length is between 0 and 65535 bytes."
      ],
      "source": {
        "section": "3.1.3.3 Will Message and 3.1.3.5 Password",
        "page": 29,
        "locator": "lines 596-612",
        "excerpt": "If the Will Flag is set to 1 the Will Message is the next field in the payload. The Will Message defines the Application Message that is to be published to the Will Topic as described in Section 3.1.2.5. This field consists of a two byte length followed by the payload for the Will Message expressed as a sequence of zero or more bytes. The length gives the number of bytes in the data that follows and does not include the 2 bytes taken up by the length itself.\n\nIf the Password Flag is set to 1, this is the next field in the payload. The Password field contains 0 to 65535 bytes of binary data prefixed with a two byte length field which indicates the number of bytes used by the binary data (it does not include the two bytes taken up by the length field itself)."
      }
    }
  ],
  "protocol_data_units": [
    {
      "id": "mqtt-control-packet",
      "name": "MQTT Control Packet",
      "kind": "packet",
      "definition": "The MQTT protocol data unit, consisting of up to three ordered components: fixed header, variable header, and payload.",
      "encoding": {
        "kind": "binary",
        "unit": "octet",
        "definition": "The common packet envelope is defined in bytes and bit fields; individual variable headers and payloads use the encodings defined by their packet types."
      },
      "source": {
        "section": "2.1 Structure of an MQTT Control Packet through 2.3 Variable header",
        "page": 16,
        "locator": "page 16 lines 223-237; page 17 lines 242-246; page 18 lines 254-265; page 19 lines 312-315",
        "excerpt": "An MQTT Control Packet consists of up to three parts, always in the following order as illustrated in Figure 2.1 - Structure of an MQTT Control Packet.\n\nFixed header, present in all MQTT Control Packets\nVariable header, present in some MQTT Control Packets\nPayload, present in some MQTT Control Packets\n\nEach MQTT Control Packet contains a fixed header.\n\nPosition: byte 1, bits 7-4. Represented as a 4-bit unsigned value, the values are listed in Table 2.1 - Control packet types.\n\nThe remaining bits [3-0] of byte 1 in the fixed header contain flags specific to each MQTT Control Packet type as listed in the Table 2.2 - Flag Bits below.\n\nPosition: starts at byte 2.\n\nThe Remaining Length is the number of bytes remaining within the current packet, including data in the variable header and the payload. The Remaining Length does not include the bytes used to encode the Remaining Length.\n\nSome types of MQTT Control Packets contain a variable header component. It resides between the fixed header and the payload. The content of the variable header varies depending on the Packet type."
      },
      "framing": [
        {
          "id": "remaining-length-framing",
          "kind": "length_prefixed",
          "applies_when": "Every MQTT Control Packet.",
          "definition": "The packet boundary is determined from the fixed header and Remaining Length, whose value counts the bytes in the variable header and payload.",
          "field_refs": [
            "mqtt-control-packet/fixed-header/remaining-length"
          ],
          "source": {
            "section": "2.2.3 Remaining Length",
            "page": 18,
            "locator": "lines 254-265",
            "excerpt": "Position: starts at byte 2. The Remaining Length is the number of bytes remaining within the current packet, including data in the variable header and the payload. The Remaining Length does not include the bytes used to encode the Remaining Length. The Remaining Length is encoded using a variable length encoding scheme which uses a single byte for values up to 127. The maximum number of bytes in the Remaining Length field is four."
          }
        }
      ],
      "layout": [
        {
          "id": "fixed-header",
          "name": "Fixed header",
          "order": 1,
          "occurrence": "one",
          "definition": "Present in every MQTT Control Packet and contains the Control Packet type, packet-type-specific flags, and Remaining Length.",
          "fields": [
            {
              "id": "packet-type",
              "name": "MQTT Control Packet type",
              "occurrence": "one",
              "location": "byte 1, bits 7-4",
              "representation": "4-bit unsigned integer",
              "definition": "Selects the MQTT Control Packet type using the values in Table 2.1.",
              "constraints": [
                "Values 0 and 15 are reserved and forbidden."
              ]
            },
            {
              "id": "flags",
              "name": "Flags",
              "occurrence": "one",
              "location": "byte 1, bits 3-0",
              "representation": "4 packet-type-specific bits",
              "definition": "Uses either the fixed reserved value or PUBLISH-specific subfields defined for the selected packet type in Table 2.2.",
              "constraints": []
            },
            {
              "id": "remaining-length",
              "name": "Remaining Length",
              "occurrence": "one",
              "location": "starts at byte 2",
              "representation": "1-4 byte variable-length integer; seven data bits and one continuation bit per byte",
              "definition": "Gives the number of bytes in the variable header and payload, excluding the bytes used to encode Remaining Length.",
              "constraints": [
                "The field contains at most four bytes.",
                "The maximum representable value is 268435455.",
                "A continuation bit on the fourth byte makes the packet malformed."
              ],
              "source": {
                "section": "2.2.3 Remaining Length",
                "page": 18,
                "locator": "page 18 lines 254-278; page 19 lines 296-307",